{
    "$schema": "../schema/font.schema.json",
    "id": "figtree",
    "family": "Figtree",
    "category": "sans",
    "provider": "google",
    "next": {
        "import": "Figtree",
        "variable": "--font-sans-figtree"
    },
    "fontsource": {
        "package": "@fontsource-variable/figtree",
        "variable": true,
        "css": "@fontsource-variable/figtree",
        "family": "Figtree Variable"
    },
    "weights": [
        400,
        500,
        600,
        700
    ],
    "axes": [
        "wght"
    ],
    "subsets": [
        "latin"
    ],
    "hangul": false,
    "license": {
        "name": "OFL-1.1",
        "url": "https://openfontlicense.org"
    }
}
